{
  "listener_transport": "loopback_h1",
  "process": "PROCESS-22009",
  "receipts": [
    {
      "assertion_binding": "declaration",
      "assertion_ids": [
        "publication.incompatible_or_gap",
        "publication.inflight_old_revision",
        "publication.lkg_restart"
      ],
      "execution": "real_hirouted_native_provider",
      "id": "authority.live_publication",
      "source": "tools/e2e-harness/tests/p0_gateway_request_authority.rs",
      "symbol": "production_hirouted_live_publication_control_pins_cutover_and_preserves_lkg_on_nack",
      "test_target": "p0_gateway_request_authority"
    },
    {
      "assertion_binding": "declaration",
      "assertion_ids": [
        "gateway.isolated_native_listener",
        "authority.shared_entry_selects_alias_plan",
        "authority.unknown_or_unauthorized_alias",
        "authority.catalog_and_etag",
        "authority.alias_budget",
        "gateway.loopback_h1"
      ],
      "execution": "real_hirouted_native_provider",
      "id": "authority.wire_listener",
      "source": "tools/e2e-harness/tests/p0_gateway_request_authority.rs",
      "symbol": "production_hirouted_wire_authority_catalog_deadline_and_actual_restart",
      "test_target": "p0_gateway_request_authority"
    },
    {
      "assertion_binding": "declaration",
      "assertion_ids": [
        "protocol.responses_to_responses",
        "protocol.responses_to_chat_completions",
        "protocol.responses_to_messages",
        "protocol.chat_completions_to_responses",
        "protocol.chat_completions_to_chat_completions",
        "protocol.chat_completions_to_messages",
        "protocol.messages_to_responses",
        "protocol.messages_to_chat_completions",
        "protocol.messages_to_messages",
        "protocol.exact_native_request",
        "protocol.exact_client_projection",
        "protocol.fragmented_ingress",
        "protocol.preconnect_rejection"
      ],
      "execution": "real_hirouted_native_provider",
      "id": "protocol.nine_native_pairs",
      "source": "tools/e2e-harness/tests/p0_gateway_protocol/production_matrix.rs",
      "symbol": "production_matrix::protocol_real_hirouted_executes_every_native_protocol_pair_and_rejects_before_provider",
      "test_target": "p0_gateway_protocol"
    },
    {
      "assertion_binding": "runtime_assertion_marks",
      "assertion_ids": [
        "protocol.tool_round_trip",
        "protocol.sse_fragmented_semantics",
        "protocol.native_tool_identity",
        "protocol.stream_usage_terminal",
        "protocol.namespace_native_acceptance",
        "protocol.namespace_upstream_rejection",
        "protocol.continuation_request_authentication",
        "protocol.continuation_restart_native_history"
      ],
      "execution": "real_hirouted_native_provider",
      "id": "protocol.tool_and_sse",
      "source": "tools/e2e-harness/tests/p0_gateway_protocol/continuation.rs",
      "symbol": "continuation::production_native_tool_history_survives_restart_with_request_authentication",
      "test_target": "p0_gateway_protocol"
    },
    {
      "assertion_binding": "declaration",
      "assertion_ids": [
        "planner.frozen_order_consumed",
        "planner.reason_ledger_identity"
      ],
      "execution": "real_hirouted_native_provider",
      "id": "planner.runtime_consumption",
      "source": "tools/e2e-harness/tests/p0_gateway_runtime.rs",
      "symbol": "real_listener_consumes_planner_order_and_binds_reason_ledger_identity",
      "test_target": "p0_gateway_runtime"
    },
    {
      "assertion_binding": "declaration",
      "assertion_ids": [
        "runtime.binding_fault",
        "runtime.frozen_budget",
        "runtime.precommit_fallback"
      ],
      "execution": "real_hirouted_native_provider",
      "id": "runtime.fallback",
      "source": "tools/e2e-harness/tests/p0_gateway_runtime.rs",
      "symbol": "real_hirouted_reaches_native_provider_and_falls_back_before_commit",
      "test_target": "p0_gateway_runtime"
    },
    {
      "assertion_binding": "declaration",
      "assertion_ids": [
        "runtime.context_hold.simple_to_complex",
        "runtime.context_hold.complex_to_simple",
        "runtime.context_hold.rebuild",
        "runtime.context_hold.responses_search_append"
      ],
      "execution": "real_hirouted_native_provider",
      "id": "runtime.context_hold.classified",
      "source": "tools/e2e-harness/tests/p0_gateway_context_hold.rs",
      "symbol": "real_hirouted_holds_only_inside_each_classified_branch",
      "test_target": "p0_gateway_context_hold"
    },
    {
      "assertion_binding": "declaration",
      "assertion_ids": [
        "runtime.context_hold.success_only",
        "runtime.context_hold.fallback_origin"
      ],
      "execution": "real_hirouted_native_provider",
      "id": "runtime.context_hold.fallback",
      "source": "tools/e2e-harness/tests/p0_gateway_context_hold.rs",
      "symbol": "real_hirouted_holds_the_successful_fallback_and_releases_it_on_rebuild",
      "test_target": "p0_gateway_context_hold"
    },
    {
      "assertion_binding": "declaration",
      "assertion_ids": [
        "protocol.previous_response_id_preconnect_rejection"
      ],
      "execution": "real_hirouted_native_provider",
      "id": "protocol.previous_response_id",
      "source": "tools/e2e-harness/tests/p0_gateway_context_hold.rs",
      "symbol": "real_hirouted_rejects_opaque_previous_response_id_before_provider_io",
      "test_target": "p0_gateway_context_hold"
    },
    {
      "assertion_binding": "declaration",
      "assertion_ids": [
        "runtime.multiple_keys",
        "runtime.quota_key_handoff",
        "runtime.binding_overload"
      ],
      "execution": "real_hirouted_native_provider",
      "id": "runtime.key_handoff",
      "source": "tools/e2e-harness/tests/p0_gateway_runtime.rs",
      "symbol": "real_listener_distinguishes_quota_key_scope_from_overload_binding_scope",
      "test_target": "p0_gateway_runtime"
    },
    {
      "assertion_binding": "declaration",
      "assertion_ids": [
        "runtime.cas_write_fault",
        "runtime.fail_closed_503",
        "runtime.zero_fallback_after_fault",
        "runtime.zero_bad_state_persist"
      ],
      "execution": "real_hirouted_native_provider",
      "id": "runtime.cas_write_fault",
      "source": "tools/e2e-harness/tests/p0_gateway_runtime.rs",
      "symbol": "real_listener_runtime_state_cas_write_failure_is_fail_closed_and_one_shot",
      "test_target": "p0_gateway_runtime"
    },
    {
      "assertion_binding": "declaration",
      "assertion_ids": [
        "runtime.probe_write_fault",
        "runtime.probe_zero_attempt",
        "runtime.probe_one_shot_recovery"
      ],
      "execution": "real_hirouted_native_provider",
      "id": "runtime.probe_write_fault",
      "source": "tools/e2e-harness/tests/p0_gateway_runtime.rs",
      "symbol": "real_listener_probe_write_failure_creates_no_attempt_and_recovers_once",
      "test_target": "p0_gateway_runtime"
    },
    {
      "assertion_binding": "declaration",
      "assertion_ids": [
        "runtime.postcommit_no_retry",
        "runtime.postcommit_provider_count"
      ],
      "execution": "real_hirouted_native_provider",
      "id": "runtime.postcommit",
      "source": "tools/e2e-harness/tests/p0_gateway_commit_boundary.rs",
      "symbol": "real_listener_postcommit_disconnect_never_creates_another_attempt",
      "test_target": "p0_gateway_commit_boundary"
    },
    {
      "assertion_binding": "declaration",
      "assertion_ids": [
        "replay.threshold",
        "replay.two_attempts",
        "replay.bounded_memory"
      ],
      "execution": "real_hirouted_native_provider",
      "id": "replay.threshold",
      "source": "tools/e2e-harness/tests/p0_gateway_replay.rs",
      "symbol": "real_hirouted_replays_threshold_below_and_above_for_two_fallbacks",
      "test_target": "p0_gateway_replay"
    },
    {
      "assertion_binding": "declaration",
      "assertion_ids": [
        "replay.accessible_root",
        "replay.existing_root_mode_preserved",
        "replay.provider_call"
      ],
      "execution": "real_hirouted_native_provider",
      "id": "replay.accessible_root",
      "source": "tools/e2e-harness/tests/p0_gateway_replay.rs",
      "symbol": "real_hirouted_accepts_accessible_replay_root_without_chmod",
      "test_target": "p0_gateway_replay"
    },
    {
      "assertion_binding": "declaration",
      "assertion_ids": [
        "replay.request_capacity_limit",
        "replay.zero_provider_on_capacity"
      ],
      "execution": "real_hirouted_native_provider",
      "id": "replay.request_capacity",
      "source": "tools/e2e-harness/tests/p0_gateway_replay.rs",
      "symbol": "real_hirouted_rejects_unavailable_request_workspace_before_provider_call",
      "test_target": "p0_gateway_replay"
    },
    {
      "assertion_binding": "declaration",
      "assertion_ids": [
        "replay.owner_only_plaintext",
        "replay.single_backing"
      ],
      "execution": "real_hirouted_native_provider",
      "id": "replay.local_plaintext",
      "source": "tools/e2e-harness/tests/p0_gateway_replay.rs",
      "symbol": "real_hirouted_uses_one_owner_only_plaintext_replay_backing",
      "test_target": "p0_gateway_replay"
    },
    {
      "assertion_binding": "declaration",
      "assertion_ids": [
        "replay.cancel_cleanup",
        "replay.orphan_cleanup"
      ],
      "execution": "real_hirouted_native_provider",
      "id": "replay.cancel_orphan",
      "source": "tools/e2e-harness/tests/p0_gateway_replay.rs",
      "symbol": "real_hirouted_cleans_exhaustion_deadline_disconnect_and_restart_orphan",
      "test_target": "p0_gateway_replay"
    },
    {
      "assertion_binding": "declaration",
      "assertion_ids": [
        "replay.long_prompt",
        "replay.long_sse",
        "replay.rss_bound",
        "replay.release"
      ],